,negReviews,posReview,review_date,review_rating
74,"The pace isn't for everyone, and specifically for my team, neither is the travel. Many people hear horror stories during ""peak"" - the busy holiday season - and while I've seldom been unhappy, I have worked 80/90+ hour weeks from time to time during our busy season. Again, this is the exception rather than the rule. My standard week is much more like 50-60 hours.People who are successful at Amazon also need to be flexible and adaptable - ""the only constant is change,"" as I hear often.I can't speak to other groups or the corporate environment.","Amazon is an incredibly-fast moving company. My first week on the job, my boss promised me that no matter what, I would ""never be bored"" and 3.5 years in, that's held true.Working in the team responsible for installing new fulfillment centers (warehouses), I am given high responsibility of budgets of dozens of millions of dollars and high levels of autonomy. I have exposure to network-wide issues and have the opportunity to travel extensively domestically with occasional international assignments.The position has also been a huge learning source, and I feel like I am still learning something new every day."," Sep 10, 2018",5.0
75,None yet check back soon,Pay hours benefits ot holiday pay," Sep 10, 2018",5.0
76,"Most people who work here have high standards, especially of themselves, so people feel a lot of pressure from within. This can lead to people being a bit negative.In a large organization and at the huge scale of Amazon, it is difficult to take a big idea from conception to deployment. It is hard to know who owns what, how to navigate the organization and inject a new idea into an existing budgeted and approved roadmap.","Amazon wants their employees to work on projects where they can use their best strengths.Because Amazon has so many teams working on so many different products, you can find a great fit for your combination of strengths.Most people who work here are bright, hardworking and of good character."," Sep 10, 2018",5.0
77,"Auxiliary employee benefits (gym membership, etc.) and other side perks could be betterOnly two weeks of vacation in the first year",Fantastic opportunity to work with smart people on cutting edge technologiesFast paced and challenging (in a good way) work environmentVery little or no overhead and freedom to innovate," Sep 10, 2018",5.0
78,* High priority or large issues may disturb work life balance for a day or so.* Internal tool experience may not be useful outside amazon.,"* New cloud technologies* Opportunity to experiment and design highly scalable systems.* Depending on location, pets are allowed* Internal training and conferences to grow and explore careers"," Sep 10, 2018",5.0
79,No cons as I know what I signed up for.,I love working here at Amazon. They make you feel like that you are the owner of your workplace. Management listens to ideas and always give you feedback. Love the straight forward approach with everyone.," Sep 10, 2018",5.0
80,Not a lot of hours,Good pay and easy job to do," Sep 10, 2018",4.0
81,Tight deadlines and fast-moving pace.,Have the opportunities to work on some of the most exciting projects and work with smart people as well.," Sep 10, 2018",4.0
82,Work life balance. High associate driven engagement culture sometimes gets in the way of making tough decisions,Lots of growth opportunities. Flexibility to move around the company. Travel. Great place to learn and develop.," Sep 10, 2018",4.0
83,Management keeps pushing pick rates that are unrealistic unless you grab and go,Pick your own schedule. Easy work," Sep 7, 2018",4.0
84,You’ll have to deal with some coworkers who aren’t team players,Set your own scheduleEasy hiring processAbility to move up in companyGreat atmosphere," Sep 4, 2018",5.0
85,There's sometimes just too much pressure for coming up with a short term solution.,The company has best engineers around to learn from.," Sep 9, 2018",4.0
86,- No snacks...- Pay is a little lower than other tech companies.,"- Good experience with colleagues and managers- Good benefits: medical, commuting, etc.- Flexible work hours."," Sep 9, 2018",4.0
87,Too many chiefs for the amount of indians,Plenty of paid time off and vaction," Sep 9, 2018",4.0
88,"The biggest draw back with Amazon is your work week life balance. The hours are long and exhausting which leaves little time or energy outside of the work week. Although the work week is only 4 days, it can at times be a little much.","Amazon has allowed me to move from an entry level warehouse associate to a manager in just over 3yrs. There are lot of opportunities and many kinds of operations within the umbrella of Amazon. I have worked in 3 different networks and have held 5 different positions in only 6 years. If you are motivated and want to make a difference, then this is the place for you."," Aug 29, 2018",5.0
89,It is not for everyone. You find out quickly if you have what it takes to stay.,There is so much exciting work within the company.," Sep 7, 2018",5.0
90,"Inequitable expectations & work pressure, over-reliance on stock price growth, arbitrariness disguised as frugality.","Smart people, strong work ethic, close integration with business partners, casual atmosphere, new things happen every day."," Sep 8, 2018",4.0
91,Long hours poor management etc,Super great benefits great friends," Sep 6, 2018",5.0
92,"Extreme frugality: you need to spend time to get lunch outside the office, the coffee in the office is extremely light, workspace is a bit crowded, the IT equipments are pretty basic. Admittedly this is also why Amazon is so successful in keeping the price low.","- first-class software organization- peculiar leadership principles, and the employees do breathe and live with them. They are really and frequently used in assessing strategies, products, processes, and people.- senior leaders are often right a lot and dive deep- lots of internal transfer opportunities and different career choices- contrary to a lot external articles, there are a lot of care and support from management, HR, and company level. the benefits are decent."," Sep 7, 2018",5.0
93,"They have one question surveys that all of your work if based off from, if everyone answers ""no"" you get wrote up","They have a lot of support, via supervisors or peers or knowledge database"," Sep 3, 2018",5.0
94,"Physically demanding, blackout periods, short lunches","Decent pay, benefits, flexible hours, holiday pay"," Sep 6, 2018",4.0
95,"Huge system, distributed management. Different standards in each team.",You can learn real time experience of handling large system.," Sep 6, 2018",4.0
96,"Older adults, for the most part will not be promoted because management is usually young and they tend to overlook the value of experienced employees.Many tier one associates will be trained on the Kiva floor where they are expected to work in a dangerous environment without the benefit of extra pay. Long distances in these large warehouses means you have to move fast to get to break rooms for 15 minute breaks where most breaks will last you only 7 to 8 minutes.","Good place for young adults to start learning how to work. Good place for older adults to finish their working careers if all they truly need is benefits. Young aggressive adults will be promoted. Benefits are good. Time off is generous. 10 hour 4 day work week is a benefit to most employees. Amazon offers to pay for college and technical training. Coaching for resumes and interviews. Starting wages are fair and there are quick raises. Many other internal benefits such as training in new departments or processes and training in PIT (Powered Industrial Trucks). Associates, for the most part, are friendly to each other. Bathrooms are clean. Generally the Operations Manager holds an all hands meeting once a month and they generally do a good job engaging the employees. Peak times Amazon tries to create an atmosphere of fun and games. They also raffle off many great prizes during Peak times. Amazon has a very good program offering company stocks to full time employees. Each year around February, Amazon offers employees to quit with a severance pay that pays into the thousands depending on the number of ""peaks"" you successfully worked through."," Sep 15, 2018",3.0
97,pay can be more but who knows,growth is very likely within this company," Sep 5, 2018",5.0
98,"Not a friendly environment and no welcome (besides orientation) for new employees. Once you're hired, you're on your own. AWS, although huge, still runs like a startup, with lots of chaos and few established, reliable processes. And there are some key senior people with limited experience and don't know what they don't know.","Nice people, genuine effort to put substance over style, supportive colleagues, true customer obsession, passion for ideas and innovation, sense of mission, visionary leadership"," Sep 5, 2018",5.0
99,i didnt find any difficulties,Excellent place to work and friendly environment.," Sep 6, 2018",5.0
