,negReviews,posReview,review_date,review_rating
0,"No cons, so far - seriously. Like I said, I'm sure Amazon has some bad pockets in it here and there, but this is an amazing job, an amazing opportunity, and the biggest thing I have to complain about is that it's a little chilly in our building. I can live with that.Does Amazon demand high quality, measurable results? Yes! Is it hard work? Yes! Is it rewarding? Yes! So I'm not calling that a 'con'. Work/life balance seems comparable to other places I've worked - not worse.","I've been at Amazon for a month now, and I've seen none of the horror stories being communicated to the public, although Amazon is a large enough company that I'm sure there are good pockets and bad pockets. Everyone here is really smart, and wants to succeed both personally, and as a company. People collaborate and help each other, focus on data, and truly focus on the customer. Every company I've ever worked for talks about how important the customer is, but on day 2, they're forgotten. Amazon seems to genuinely focus on what's best for the customer, and it's awesome to be in meetings where people actually bring that up, and make decisions focused on long-term customer satisfaction.The opportunities to learn here are literally unlimited, and the opportunity to take on new responsibility is as well. I honestly believe you can be as awesome as you want here.",,5.0
1,The flow of information can be overwhelming. There are so many services and they go so deep. There are often key roles missing because of our high hiring bar and the economics of the job market.,"I've been at AWS for about six years all in Sales. In that time I've received promotions, chances to change roles, and it's never been boring. I've kept to working 40 hours per week and use up all my vacation. It's a high growth company and management supports movement across departments. There's an intensity here that I think comes from a high bar from hiring. However, I haven't felt the pressure from the executive team to deviate from the work/life balance I want to protect."," Sep 4, 2018",5.0
2,"You have to be self motivated. NO ONE will hold your hand and tell you that you're doing a great job. If you need constant affirmations from management, this company isn't for you.","Really smart people, a lot of opportunity for growth, always encouraged to be innovative, think big, and create something new. Competitive salary and benefits with other major tech companies. 100% self motivating work environment. No dress code and 4 legged friends are welcome."," Jan 10, 2016",5.0
3,"The management process is abusive, and I'm currently a manager. I've seen too much ""behind the wall"" and hate how our individual performers can be treated. You are forced to ride people and stack rank employees...I've been forced to give good employees bad overall ratings because of politics and stack ranking.","Jeff Bezos and his ""S-Team"" are brilliant and continue to make great decisions for long-term growth.You work with smart people, you work on exciting projects, you are pushed to your limits...which can be rewarding when you accomplish great things. The diversity of the potential work and innovation can be very alluring. I've often called Amazon my ""Sexy Mistress...she's emotionally abusive, but she's so sexy that I go back for more punishment."""," Feb 20, 2016",3.0
4,"- You're responsible for your own career progression and finding the places and teams that are doing the stuff you want to do. No one is going to take you by the hand and help you with that.- Amazon is built, quite deliberately, to be Darwinian. The strong survive and the weak perish (metaphorically speaking) and the 'bar' is constantly increasing. The level of performance that would have been acceptable five years ago will get you canned today. It's a kind of crucible that'll help you develop a harder edge, if you can survive, that can serve you well in your career and in life, but it's often not a pleasant experience.I wouldn't recommend it as a place to work for just anyone.","Amazon is doing lot's of cool stuff...but lots of boring stuff too. There are really well run teams...and very badly run teams. The experience for software managers and engineers is all over the board, from really run low operational load teams to teams where people burn out after a year. - Amazon is built, quite deliberately, to be Darwinian. You can generally expect that anyone who's been here for more than 2 years is competent and motivated or they wouldn't have survived. You can count on them as long as your priorities are aligned. There aren't many slackers here, and they don't survive long.  - We work on so much stuff that there's always an opportunity to find amazing cool stuff to work on (note that it's an 'opportunity', one that you have to pursue)  - A chance to make a huge difference  - A place where you can learn a lot about all kinds of things, both technical and about yourself  - Amazon encourages high mobility - even your manager can't prevent you from moving to another team within 6 weeks (normally, more than a few months under unusual conditions).  - Your friends and family have actually heard of the place you work and have at least a vague notion of what Amazon does without you having to explain"," Dec 17, 2013",4.0
5,"Maybe because the company recruits C listers who have neither merit (intelligence, strategic vision) nor pedigree (academic or professional accomplishments), most of those who become successful do so in treacherous, low cunning ways.Imagine the Lannisters in Game of Thrones attacking the Starks in Game of Thrones; or Rawls and Burrell attacking McNulty and Daniels in The Wire; or Barrow and O'Brien attacking Mr Bates in Downton Abbey. This is every day leadership behavior at Amazon. The culture at Amazon is so infested with these middling talent weasels who have juked the stats and schemed their way to positions of power that new employees coming in actually start thinking that this behavior is normal and expected if you want to ""manage people.""The work itself was stimulating and fulfilling, but the sneering condescension of the d bags that cheated and skated their way through high school and party colleges, then just converted their winky nod nod good 'ol boy shenanigans into a ""ask no questions, have no introspection"" company culture have made manifest some of the worst criticisms of capitalism. Any left leaning political aspirant would look at this business organism and immediately have content to lash out against the corruption that can come in free enterprise where hard work is not rewarded, and the connected, incestuous, privileged class lounge their way to wealth while treating their employees and customers like some kind of filth their shoe picked up on the street.",This company gets A list performance from C list employees. The culture is quick and hard charging. You are always working in relevant and meaningful projects.," Mar 23, 2017",4.0
6,"After 3 years of working with the company you ""cap out"" at $15.75, meaning you can no longer make any more money than that as a tier 1 associate. Your expected to want to move up in the company and that is the only way to make a better hourly wage, by advancing into management and operations management positions if there are any openings.","Great starting pay and the ability to get raises very quickly. Full training in all areas are offered and if your willing to work hard and sweat everyday for 10 hours a day, 4 days a week, then this is the job for you. The 4 day weeks go by quick, it can be exhausting so proper rest and a healthy lifestyle will help you stay strong within this company. Beat benefits as well once you are a hired on as a full time employee."," May 15, 2017",4.0
7,"- frugality is taken to the extreme, only 2 weeks vacation, parking takes a year or more to get, zero perks (not even free Prime), no fitness allowance, poor 401k- your peers will stab you in the back, your manager will blame you for their errors, you can't trust anyone- people who throw others under the bus and take credit for other people's work get promoted- expectations 60 -70 hours a week, some teams expect Sunday to be an ""in the office day"", headcount never gets filled, teams are always short a few people but the work keeps piling on.","- super smart people, the best of the best from schools- if you get hired here, you will be hirable anywhere, recruiting process is tough- the pay is above average, probably 1.5 times elsewhere (but the expected results are 150% of elsewhere too)- lots of opportunities to work on new, innovative projects- cool SLU campus, lots of options for food and drinks after work"," Mar 29, 2017",4.0
8,The breaks are short but you'll get the hang of it.,The moneyThe benefitsPretty safeFast paced," Sep 12, 2018",5.0
9,It is a big company but still a part of a team.,Great team and awesome benefits. A lot of ambiguity and fast paced environment.," Sep 18, 2018",5.0
10,"Not much upward mobility, employees could be treated better.","Great work atmosphere, good culture."," Sep 19, 2018",4.0
11,Expectations can be grey and ever changing. Path to promotion unclear and political. Not paid enough for the scope of work.,Great opportunity to build skills and experience.," Sep 19, 2018",4.0
12,Sometimes builds the wrong things,"Moves fast, interesting problems, commensurate pay"," Sep 19, 2018",4.0
13,training should be at the location u work for,great company helps people get a job not a long process to get a job," Sep 17, 2018",5.0
14,"Nothing yet, just started...will come back if have to","Benefits, wage, break room, time off"," Sep 18, 2018",5.0
15,- on boarding is not great- limited communication across company,- fast passed company- high emphasis on culture- extremely intelligent co-workers- work life balance possible," Sep 18, 2018",5.0
16,"Pay tops out at warehouse normal, long days, stressful peak, forced overtime managers that only care about hitting their numbers","Benefits, sweat, competition, overtime, sometimes fun, 3 days off."," Sep 10, 2018",4.0
17,No work life balance. Promotions hold more bias than from where the company was a few years back.,"Great stock, benefits, and great schedule.Always growing, full of great minds."," Sep 17, 2018",4.0
18,"Schedule is 4 day, 10 hours every day",Amazon provides really good Benefits," Sep 17, 2018",4.0
19,A lot of walking. Breaks should be a little longer.,"Straightforward, 4 hour shifts, 24 hours."," Sep 18, 2018",4.0
20,"Lots of people, constantly change","Good work environment, good people, responsive"," Sep 18, 2018",4.0
21,Not Cut for EveryoneYou must be thick skin to take criticism constructivelyNo Hand holdingLong On-boardingLack of standardized process - Due to super fast deliveryNo Powerpoints,Very RewardingFast and FuriousLots of learningJob SatisfactionStocks :)No Power-points," Sep 17, 2018",5.0
22,Work can be challenging - but that’s also a good thing!,Great work cultureGrowth is encouragedDog friendly officesFun place to workFlexible hours," Sep 17, 2018",5.0
23,The pace can be a grind.,"Super-cool projects, extremely customer focused, tons of great talent."," Sep 17, 2018",5.0
24,"- Some people are too afraid not to meet deadlines, which at times makes you sacrifice quality for delivery.- Depending on which team you're on, culture might be a huge impact on your day to day job.- Some managers remain, even though they drive away great employees from their teams just because they deliver results.- Proper access to upper management is sometimes not available, and causes problems to the people making things happen day to day.- If you don't keep track of your own schedule, you can be working 100 hour weeks without even noticing.","- This is the first time in my career when I'm surrounded with nothing but incredibly smart and focused individuals.- Compensation is well beyond my expectations, and more than suitable.- Exciting projects all across the company that keep you interested and focused.- Ability to reach customers all across the world with unbelievable new technologies.- Ability to focus on the customer without worrying about what the other companies in the same field are doing.- Company not worried about failing, know that you can learn from your mistakes and still come out on top."," Sep 17, 2018",5.0
25,Little benefits comparing to other companies.,Good Package. Good environment. Good team. Good top.," Sep 17, 2018",5.0
26,"- It takes 6 months to adjust to everything- Once your here, you will get some perfunctory training; but if you want more you have to seek it yourself- ""Onboarding"" is confusing and frustrating, so you have to go out of your way to ask where to go and what to do",- The Pay rate- The People- Dogs- Downtown Seattle- SO MANY Company events that are helpful and also fun," Sep 17, 2018",5.0
27,"There is a heavy emphasis on metrics and business writing. If you are not a good writer, it can affect your growth. But there are many resources to get help and learn how to write better. There is even a volunteer group of Amazonians called the ""Doc Ninjas"" who help review documents and make suggestions to improve the writing. Very cool!","There are so many opportunities and they have set up the work environment to help you find the best fit possible. My first team was a good fit, but my next team is an awesome fit for me. You are encouraged to grow professionally and personally. Work/Life balance is a focus. I don't feel the need to work 100+ hours a week. There are those who do so, but they do so voluntarily. I have not received pressure to do so. I love my job!"," Sep 17, 2018",5.0
28,Your work/life balance depends on the team you are in. Some people will work from 9-5 and be able to work from home when needed. Other people will work crazy hours and will have to go to the office everyday no matter what.,"Fast paced, long term driven, customer obsessed. Very smart people."," Sep 17, 2018",5.0
29,Sometimes (depending on team) there was a stress and env pressure,"Always busy and learning, and never bored"," Sep 16, 2018",4.0
30,Favortism. Consistently need to check up on request made via management.,Flexible staff. Fluid workflow.," Sep 17, 2018",4.0
31,Stressful at times and open on all holidays on closed 2 days a year so i am sure it becomes a larger burden on family life the further up you move same as any other job,"Growth as a leader while gaining a lot of skills such as multitasking, situational decision making earning trust among your peers."," Sep 17, 2018",4.0
32,Too many people working at one line,Part time and benefits," Sep 17, 2018",4.0
33,"not sure , maybe work life balance",Good Pay and a lot of challenge work," Sep 17, 2018",4.0
34,If your not good with a fast pace or change and just like status quo or decision by debate or deliberation this is not the place for you.,"The environment. Work Hard, Have Fun, & Make History is more than words, it's a mantra that is upheld every minute of every day."," Sep 12, 2018",5.0
35,Not that many hours,"Good benefits, fast work, easy work"," Sep 15, 2018",4.0
36,Sometimes there is lot of work pressure,Best and brightest people to work with," Sep 14, 2018",5.0
37,"-compensation could be better considering the work but its still ok-fast paced environment that is constantly changing-if you need your hand held this is NOT the position for you-sometimes the systems can go wonky making it a hard day-this is a metrics based position and you have to work hard to keep them up if you want to succeed, and sometimes no matter how hard you try you will fail because its basically up to the customer to grade you.","-Learning new things everyday-Leadership is always there to help, is friendly, encouraging, and wants to see you succeed.-pay is good for a Work From Home position-Amazon sends all the equipment and training needed to effectively carry out your job-fun and lively atmosphere to work in-receives recognition for your work on a constant basis-able to proceed up through the company internally-peers are always available to help when needed.- will work with disabled, and people attending school to succeed- great benefits and bonus's-creatively able to troubleshoot and handle problems that are faced by customer.I love my job at Amazon!!! I was a quality engineer for 22 years and went into early retirement. I got bored and decided to apply. I'm so happy I did! This is one of the most fun and gratifying positions that I ever had."," Sep 8, 2018",5.0
38,Have Limited technical growths opportunities,Very good Business ownership for ic," Sep 14, 2018",4.0
39,"Nothing much, some people work overtime",The best environment to advance in your career.," Sep 15, 2018",4.0
40,Workload. The business is expanding and there are never enough people to get the job done,"I joined AWS 3 months ago. Nothing but good things to say about the company. Coming from 25 years of experience in corporate world (Wallstreet, Retail, Business Consulting) Amazon is the place to be.Customer is always at the forefront of the business. Working backwards works, those concepts stimulate the culture in a unique, very appealing, way."," Sep 13, 2018",5.0
41,Long hours you get sweaty,Good pay and benefits plus 3 days off," Sep 14, 2018",5.0
42,It's hard to get in. We often turn away good people who are left with no clear idea why they didn't make it.,"Great people, challenging projects, fast-paced environment."," Sep 10, 2018",5.0
43,Managers can sometimes be hard to deal with.,If you are a hard worker you can move up the ladder very quickly.," Sep 13, 2018",4.0
44,"Your manager is 90% of what matters at Amazon. I’ve seen more than one person get completely screwed when a re-org gave them a bad manager. I’ve seen people I look up to driven out of the company, when less than a year before they were given the highest possible rating by a different manager. Amazon does have a system that lets people appeal manager decisions, but it’s sort of a coin toss.","My skills, network, career and compensation have never stopped growing at Amazon. I’ve achieved great work-life harmony."," Sep 14, 2018",4.0
45,Need for knowledge/process sharing amongst some teams must improve,Opportunity to move between roles easily," Sep 14, 2018",4.0
46,Non are there at TV his time,"Benefits, salary, bonus, stock, travel"," Sep 12, 2018",5.0
47,There is no growth technically,One of the employees friendly company," Sep 12, 2018",4.0
48,Very political. You must be in the clicks or you will not move on or up.,Unlimited potential for hard work and long hours. Can not beat RSU option.," Sep 13, 2018",4.0
49,Dont really know any,I think it's a great future jobIt's a job that keeps you moving that's what I like," Sep 11, 2018",5.0
50,None. Could improve on promotion,"Good Compensation, alot of other perks"," Sep 11, 2018",5.0
51,Sometimes we feel it as not a team work but as an individual game player,"Job Satisfaction, security, vast exposure to learn"," Sep 12, 2018",5.0
52,Long hours and short lunch,"Benefits are really good, meet nice people"," Sep 12, 2018",5.0
53,10 hour shiftsexpected to hit rates,Vending machines in the break roomsGreat culture with lots of interesting people," Sep 12, 2018",5.0
54,"The hours, for someone who has a daytime job... are terrible. You cant leave until you finish your work no matter what.","The work isn't bad, sorting the packages for all of long island. Getting the trucks together at the end of shift was a little fun."," Sep 12, 2018",4.0
55,too much work for a human,good work in cutting tech," Sep 12, 2018",4.0
56,"None as of now, no cons.",Great company with super flexibility," Sep 10, 2018",5.0
57,Not much cash bonuses yearly,"Good salaries, nice sign on bonus and stock bonus"," Sep 10, 2018",5.0
58,There were none they literally were willing to work with you,Great place to work loved helping the customers and the work environment was wonderful," Sep 10, 2018",5.0
59,Meeting rate. Breaks need to be longer,Stable shift and hours. Over time. Good pay," Sep 11, 2018",5.0
60,"You're expected to do a lot. Do an amazing job, reach for the stars, and always be learning and growing. While there is a support system to help you achieve these things, you have to initiate and drive the process.","I've been really happy at AWS. It's a steep learning curve, but most everyone is excited and willing to help. I've been most pleased with my flexibility. Yes, the job is fast-paced, but the flexibility I have makes it totally worth it."," Sep 4, 2018",5.0
61,Internal tools are a pain - they're really slow.Dev onboarding process for freshers needs a lot of improvement. It takes ages to familiarize yourself with all internal tools - especially if this is your first job.Sometimes there's too much operational/testing workload on someone whose time is perhaps best used for development alone.,The first place I've worked at. Great team; seniors encourage learning and there's plenty of guidance. You're never kept idle because there's so much happening.," Sep 11, 2018",4.0
62,Very difficult to move up,A team work environment that is supportive of associates needs," Sep 11, 2018",4.0
63,Unfair recognization policies.,"A great company for anyone to start work. Starting pay is pretty good. Benefits, sick time and vacation time from day 1."," Sep 11, 2018",4.0
64,You will be working with the best so you will need to perform. I have always been at the top of my game until working here. I actually find it refreshing to be surounded by so many amazingly smart people.,I had heard all the hype about Amazon being a 'burn 'n churn' environment where people only lasted 2 years at most. I was told that Amazon would take every moment of my life and use me up. NOT TRUE! The majority of my teammates have been with Amazon over that 2-year mark. I have found the environment encouraging and everyone has gone out of their way to help me ramp up and do great work.," Aug 31, 2018",5.0
65,Long hours but you’ll get used to it,"Fun, easy, positive energy, surrounded by cool people,"," Sep 9, 2018",5.0
66,The hourly pay could be greatly improvedDepending on your job it can get monotonous quickly,Fantastic ManagementPlenty of time-off optionsGood benefits on day oneExcellent HR departmentsteady workflowClimate controlled warehouseplenty of parking4-10 schedule," Sep 10, 2018",5.0
67,Not for someone who would like to get a steady job,"Highly agile, very smart coworkers, truly customer centric, no nonsense, learn from best"," Sep 10, 2018",5.0
68,"If you are looking to coast or looking for a cushy job, its not for you.","Ever wonder if your work is making an impact to better lives of others? Working for Amazon gives you a chance to change the world for the better. It is a place for innovators and hard working people to get out there and build something. There is no bureaucracy, no red tape, no BS."," Sep 10, 2018",5.0
69,"AWS is not for the faint of heart. With great opportunity comes great effort. One executive likened it to “training to win the Olympics”. At times it can seem like a daunting task, but you just need to push through and learn to focus on what matters the most. There will never be enough time to finish everything. Another challenge is lack of information. When you are building something new you don’t have the luxury of existing data to pull from or predefined processes. Often times you will need to build these yourself. While these two points are strengths and opportunities, at other times they can be challenges. Finally, fast growth and decoupled teams can bring a communication challenge across certain parts of the business (who’s who, who knows what). Learning to overcome this takes some time. Be prepared to work hard to make a difference, and if you do, all these ""Cons"" become strengths / Pros as you'll be a stronger, better person for having done it.","At AWS you get to be a part of real transformative change – the kind that helps companies do things never before possible. As our economy shifts from an industrial age to an information age many companies will struggle to find there place. At AWS, through healthy and consistent principles (e.g. Customer Obsession, Earn Trust, and Dive Deep) the Amazon culture is applied and shared with customers to help them survive and thrive in this digital era. Beyond this, being a part of hard working teams focused primarily on customer outcomes, having a strong and unified culture, and the opportunity to build a better future make AWS a wonderful place to work - Truly a peculiar place."," Sep 10, 2018",5.0
70,The environment is fast paced. Prepare yourself or you will feel overwhelmed.,Amazon allows you to grow your knowledge and leverage your strengths. There are many options in the company to pursue your passions.," Sep 10, 2018",5.0
71,"If you don’t align with the leadership principles and don’t like to work hard, this is not the place for you.","Tenure does not impact your voice in meetings, a good idea is a good idea.Ability to test and fail in a safe environment.Management focuses on developing the individual.Freedom to experiment and discover, it’s up to you.Feedback is everywhere.The leadership principles are referenced in every decision."," Sep 10, 2018",5.0
72,there are no major downsides to Amazon.,You can shape your own career and there are tons of opportunities within Amazon.," Sep 10, 2018",5.0
73,-- Some politics although inevitable in big companies.-- No free meals,"-- Fast growing-- Work with talents-- Learning towards action, easy to get things done"," Sep 10, 2018",5.0
